{
  "name": "JX Suite",
  "url": "https://jxsuite.com",
  "defaults": {
    "layout": "./layouts/base.json",
    "lang": "en"
  },
  "imports": {
    "MarkdownFile": "@jxplatform/parser/MarkdownFile.class.json",
    "MarkdownCollection": "@jxplatform/parser/MarkdownCollection.class.json"
  },
  "$head": [
    { "tagName": "link", "attributes": { "rel": "icon", "href": "/favicon.svg" } },
    { "tagName": "meta", "attributes": { "name": "generator", "content": "JX Suite" } },
    {
      "tagName": "meta",
      "attributes": { "name": "viewport", "content": "width=device-width, initial-scale=1" }
    }
  ],
  "$media": {
    "--sm": "(min-width: 640px)",
    "--md": "(min-width: 768px)",
    "--lg": "(min-width: 1024px)",
    "--xl": "(min-width: 1280px)"
  },
  "style": {
    ":root": {
      "--bg-primary": "#0a0a0a",
      "--bg-secondary": "#111111",
      "--bg-surface": "#1a1a1a",
      "--bg-surface-hover": "#222222",
      "--border": "#222222",
      "--border-subtle": "#1a1a1a",
      "--text-primary": "#fafafa",
      "--text-secondary": "#a1a1aa",
      "--text-muted": "#71717a",
      "--accent": "#3b82f6",
      "--accent-hover": "#60a5fa",
      "--font-mono": "'JetBrains Mono', 'SF Mono', Consolas, 'Liberation Mono', Menlo, monospace",
      "--radius": "8px",
      "--radius-lg": "12px",
      "--max-width": "1200px"
    },
    "margin": "0",
    "padding": "0",
    "fontFamily": "system-ui, -apple-system, 'Segoe UI', Roboto, sans-serif",
    "backgroundColor": "var(--bg-primary)",
    "color": "var(--text-primary)"
  },
  "build": {
    "outDir": "./dist",
    "format": "directory",
    "trailingSlash": "always"
  }
}
